{
  "id": "amber",
  "name": "Amber Tablet",
  "color": {
    "name": "Amber",
    "hex": "#FFBF00"
  },
  "governing_law": "",
  "element": "Earth",
  "stage": "Calcination",
  "sealed": null,
  "author": "Kyle Alexander Steen the Alchemist & GAIA",
  "version": "1.0.0",
  "constraints": [],
  "affordances": [],
  "prohibitions": [],
  "proof_id": "PROOF-AMBER-TABLET-001",
  "source_path": "docs/tablets/AMBER_TABLET.md",
  "tracker_issue": 874
}
